subreddit,title,upvotes,comments,stock_tickers,sentiment,timestamp,title_length
investing,is dumping 230k in the sp at once a bad idea,860.0,884.0,None,Negative,2024-12-08 12:01:26.490308,44
investing,bitcoin is at all time high ready to trade in crypto  start your crypto trading journey with confidence on coindcx  learn karo crypto karo,2.0,0.0,None,Neutral,2024-12-08 12:01:26.491294,138
investing,does this time remind you of the dotcom era,568.0,566.0,None,Neutral,2024-12-08 12:01:26.491398,43
investing,warren buffet is holding records amount of cash in tbills right now is that a good strategy,266.0,205.0,None,Neutral,2024-12-08 12:01:26.491485,91
investing,the surprisingly negative sentiment in europe towards sp500 compared to ftse allworld,187.0,199.0,None,Neutral,2024-12-08 12:01:26.491571,85
investing,barrons intel ceo gelsinger retires the stock is gaining,157.0,58.0,None,Positive,2024-12-08 12:01:26.491649,56
investing,what are your favourite investment youtube channels,141.0,123.0,None,Neutral,2024-12-08 12:01:26.491728,51
investing,how much  of your net worth do you keep invested,131.0,384.0,None,Neutral,2024-12-08 12:01:26.491810,48
investing,wild investigation of finfluencer sponsors by the plain bagel,127.0,19.0,None,Neutral,2024-12-08 12:01:26.491888,61
investing,opinions on if trump policy is to increase domestic domestic oil production and reduce regulations wouldnt it increase supply and not necessarily demand thus lowering prices and lowering gas company stock value,123.0,166.0,None,Neutral,2024-12-08 12:01:26.491974,210
investing,my biggest fear for 2025 is declines becoming contagious if one part of the economy hiccups,119.0,107.0,None,Neutral,2024-12-08 12:01:26.492055,91
investing,do i have time to obtain wealth what do i need to do,110.0,89.0,None,Neutral,2024-12-08 12:01:26.492135,52
investing,is there any reason to be invested in a targetdate fund vs a total stock market index 401k,92.0,61.0,None,Neutral,2024-12-08 12:01:26.492217,90
investing,never miss another trade accurate trading signals 7day free trial,2460.0,0.0,None,Neutral,2024-12-08 12:01:26.492312,65
investing,3 years old autistic wanting to make sure hes financially secure,74.0,35.0,None,Neutral,2024-12-08 12:01:26.492396,64
investing,starting from ground 0 and all of this is quite overwhelming,67.0,91.0,None,Neutral,2024-12-08 12:01:26.492471,60
investing,are there big downsides to an hsa,46.0,135.0,None,Neutral,2024-12-08 12:01:26.492543,33
investing,how to buy property in portugal  best places to invest,37.0,74.0,None,Positive,2024-12-08 12:01:26.492616,54
investing,at what point is it worth taking short term capital gains tax,35.0,49.0,None,Positive,2024-12-08 12:01:26.492690,61
investing,suddenly inherited 100k at 20 is it a bad idea to combine sp500 and emerging markets and ignore all world,38.0,67.0,None,Neutral,2024-12-08 12:01:26.492765,105
investing,should i convert my 401k to iraroth ira,21.0,32.0,None,Neutral,2024-12-08 12:01:26.492836,39
investing,whats your asset allocation and how old are you,22.0,154.0,None,Neutral,2024-12-08 12:01:26.492907,47
investing,have you ever been stopped by someone asking what your investing looks like,20.0,45.0,None,Neutral,2024-12-08 12:01:26.492980,75
investing,can you sell a tbill on a treasury market before it matures without any losses,22.0,18.0,None,Negative,2024-12-08 12:01:26.493053,78
investing,quantum computing as long term investing,18.0,44.0,None,Neutral,2024-12-08 12:01:26.493124,40
investing,harness the power of macroeconomic shifts and strategize with aroundtheclock trading with micro fx futures,71.0,0.0,None,Neutral,2024-12-08 12:01:26.493215,106
investing,how do you decide what type of investor you are,15.0,61.0,None,Neutral,2024-12-08 12:01:26.493287,47
investing,question about fidelity,17.0,7.0,None,Neutral,2024-12-08 12:01:26.493356,23
stocks,tesla ceo elon musk loses bid to get 56 billion pay package reinstated,5557.0,785.0,None,Neutral,2024-12-08 12:01:39.188929,70
stocks,intel ceo pat gelsinger retires,698.0,226.0,None,Neutral,2024-12-08 12:01:39.189012,31
stocks,achr  collapse why,693.0,433.0,None,Neutral,2024-12-08 12:01:39.189092,18
stocks,many stocks still down 5090 from 2021 highs,563.0,324.0,None,Neutral,2024-12-08 12:01:39.189172,43
stocks,is anyone else a little concerned about this market jump up,554.0,465.0,None,Neutral,2024-12-08 12:01:39.189252,59
stocks,rivians potential 66 billion doe loan catches eye of muskramaswamys doge,493.0,164.0,None,Neutral,2024-12-08 12:01:39.189333,72
stocks,expected returns have gotten insane,477.0,159.0,None,Neutral,2024-12-08 12:01:39.189411,35
stocks,do you guys believe we are in the beginning of the great melt up or that a recession is coming in the somewhat near future ,322.0,634.0,None,Neutral,2024-12-08 12:01:39.189502,123
stocks,pltr where is the value,319.0,371.0,$PLTR,Neutral,2024-12-08 12:01:39.189582,23
stocks,waymo to expand to miami aims to launch robotaxi service there in 2026,309.0,115.0,None,Neutral,2024-12-08 12:01:39.189663,70
stocks,meta announces 10 billion data center in louisiana,299.0,152.0,None,Neutral,2024-12-08 12:01:39.189744,50
stocks,stellantis ceo resignes is fired,242.0,99.0,None,Neutral,2024-12-08 12:01:39.189822,32
stocks,super micro computer pops 15 after special committee finds no evidence of misconduct,220.0,74.0,None,Neutral,2024-12-08 12:01:39.189904,84
stocks,when do you take the money,221.0,306.0,None,Neutral,2024-12-08 12:01:39.189986,26
stocks,tsmc in talks with nvidia for ai chip production in arizona,208.0,32.0,None,Neutral,2024-12-08 12:01:39.190064,59
stocks,amazon sued by dc attorney general for allegedly excluding neighborhoods from prime delivery,207.0,135.0,None,Neutral,2024-12-08 12:01:39.190144,92
stocks,decades of backtesting insights that changed how i invest,186.0,72.0,None,Neutral,2024-12-08 12:01:39.190224,57
stocks,name a largecap stock and its smallcap competitor,175.0,107.0,None,Neutral,2024-12-08 12:01:39.190303,49
stocks,gelsingers push into software and edge computing was 80 of my faith in the intel leaps im holding anyone able to offer some insight,123.0,99.0,None,Neutral,2024-12-08 12:01:39.190388,131
stocks,intels ceo shakeup puts foundry plans chips act cash at risk,121.0,51.0,None,Negative,2024-12-08 12:01:39.190469,60
stocks,novembers job report shows that nonfarm payrolls are better than expected with a minimal slight rise in the expected unemployment rate,105.0,66.0,None,Neutral,2024-12-08 12:01:39.190554,134
stocks,palantir granted fedramp high baseline authorization,108.0,23.0,None,Neutral,2024-12-08 12:01:39.190631,52
stocks,playing the tiktok possible ban meta snap goog,87.0,77.0,None,Neutral,2024-12-08 12:01:39.190709,46
stocks,portfolio wrapped 2024,86.0,65.0,None,Neutral,2024-12-08 12:01:39.190786,22
stocks,whats going on with the french index,70.0,35.0,None,Neutral,2024-12-08 12:01:39.190864,36
wallstreetbets,my uber driver just checked his portfolio should i leave,71.0,1015.0,None,Neutral,2024-12-08 12:01:52.545918,56
wallstreetbets,ceo gets gunned down in the street outside an investor conference wow i bet thats going to really destroy the stock price,71.0,2293.0,None,Neutral,2024-12-08 12:01:52.546020,121
wallstreetbets,tried to gamble my way out of debt  didnt work ,71.0,2501.0,None,Neutral,2024-12-08 12:01:52.546108,47
wallstreetbets,ive lost it all,71.0,3834.0,None,Neutral,2024-12-08 12:01:52.546191,15
wallstreetbets,80k to 888k in about 15 years leveraging with margin,8714.0,800.0,None,Neutral,2024-12-08 12:01:52.546275,52
wallstreetbets,it happened,7065.0,776.0,None,Neutral,2024-12-08 12:01:52.546357,11
wallstreetbets,bought bitcoin in 2017 for about 3k i sent it to a different wallet then back to coinbase and is now above 100k literally turned 3k into 100,5883.0,446.0,None,Neutral,2024-12-08 12:01:52.546444,140
wallstreetbets,the mother of all bubbles the us has never been so overhyped relative to the rest of the world,5440.0,896.0,None,Neutral,2024-12-08 12:01:52.546529,94
wallstreetbets,musk record tesla pay package rejected again by delaware judge,5007.0,783.0,None,Positive,2024-12-08 12:01:52.546612,62
wallstreetbets,fired my old fart financial advisor stopped swing trading started taking profits started buying the dip almost no options,4782.0,527.0,None,Positive,2024-12-08 12:01:52.546700,121
wallstreetbets,duality of man,4491.0,83.0,None,Neutral,2024-12-08 12:01:52.546780,14
wallstreetbets,600k gain in one month,4266.0,492.0,None,Positive,2024-12-08 12:01:52.546864,22
wallstreetbets,make 250hour or 3000 per study with remote online research workjoin today,71.0,0.0,None,Neutral,2024-12-08 12:01:52.546956,73
wallstreetbets,robinhood getting in on the dead ceo jokes tonight,4239.0,129.0,None,Neutral,2024-12-08 12:01:52.547039,50
wallstreetbets,is this how it ends 1k to 1m back to 20k trading 150k still in checkings final hurrah,4156.0,1611.0,None,Neutral,2024-12-08 12:01:52.547123,85
wallstreetbets,fda may outlaw food dyes within weeks bombshell move would affect candy soda and cakes revolutionize american diets,4109.0,509.0,None,Neutral,2024-12-08 12:01:52.547210,115
wallstreetbets,jacked to the tits on puts  if nasdaq is red tomorrow im 100 booking a porn star,3398.0,939.0,None,Neutral,2024-12-08 12:01:52.547294,80
wallstreetbets,mcdonalds mcd trades like a mcdonalds,3242.0,105.0,$MCD,Neutral,2024-12-08 12:01:52.547375,37
wallstreetbets,microstrategy has acquired 15400 btc for 15 billion,3156.0,474.0,None,Neutral,2024-12-08 12:01:52.547457,51
wallstreetbets,collecting unemployment sitting here between my girlfriends two cats while shes at work fuckin worthless,2964.0,841.0,None,Neutral,2024-12-08 12:01:52.547542,104
wallstreetbets,nvda is best performing stock over last 51015  20 years,2785.0,373.0,None,Neutral,2024-12-08 12:01:52.547624,55
wallstreetbets,which one of you regards writes for forbes,2557.0,173.0,None,Neutral,2024-12-08 12:01:52.547706,42
wallstreetbets,congrats guys pltr now trades at 420x trailing ebitda,2475.0,425.0,$PLTR,Neutral,2024-12-08 12:01:52.547792,53
wallstreetbets,life savings gone years of work wasted,2140.0,774.0,None,Neutral,2024-12-08 12:01:52.547874,38
wallstreetbets,intel announces retirement of ceo pat gelsinger,2049.0,344.0,None,Neutral,2024-12-08 12:01:52.547956,47
wallstreetbets,south korean stocks down 6 today on south korea declaring martial law buy the dip,2023.0,387.0,None,Positive,2024-12-08 12:01:52.548039,81
stockmarket,my apple stock hit 100k,4953.0,183.0,None,Neutral,2024-12-08 12:02:05.881863,23
stockmarket,bitcoin is at all time high ready to trade in crypto  start your crypto trading journey with confidence on coindcx  learn karo crypto karo,2.0,0.0,None,Neutral,2024-12-08 12:02:05.881961,138
stockmarket,tesla loses bid to restore elon musks 56bn pay package,920.0,583.0,None,Neutral,2024-12-08 12:02:05.882048,54
stockmarket,any ideas on when to exit this is getting crazy,848.0,556.0,None,Neutral,2024-12-08 12:02:05.882133,47
stockmarket,i know its not much but i took my first step into investing,591.0,65.0,None,Neutral,2024-12-08 12:02:05.882221,59
stockmarket,do you ever wish you had the balls to buy more than what you did,389.0,180.0,None,Positive,2024-12-08 12:02:05.882308,64
stockmarket,time in the market beats timing the market ignore the noise and let it cook,198.0,36.0,None,Neutral,2024-12-08 12:02:05.882393,75
stockmarket,dont bash me but trying to learn stocks this is what i have so far,178.0,126.0,None,Neutral,2024-12-08 12:02:05.882481,66
stockmarket,is it too risky to enter the market at this time,69.0,238.0,None,Negative,2024-12-08 12:02:05.882562,48
stockmarket,if only i had the cojones,65.0,20.0,None,Neutral,2024-12-08 12:02:05.882645,25
stockmarket,if you arent having fun in the yahoo finance forum youre not truly enjoying the stocks so much drama and infighting,43.0,13.0,None,Neutral,2024-12-08 12:02:05.882737,115
stockmarket,hoping to reach 22k in my portfolio and im out completing the down payment for a house what you think,31.0,89.0,None,Neutral,2024-12-08 12:02:05.882824,101
stockmarket,tesla fever,26.0,54.0,None,Neutral,2024-12-08 12:02:05.882911,11
stockmarket,never miss another trade accurate trading signals 7day free trial,2459.0,0.0,None,Neutral,2024-12-08 12:02:05.883001,65
stockmarket,how to you chose a stock,29.0,43.0,None,Neutral,2024-12-08 12:02:05.883084,24
stockmarket,these are the stocks on my watchlist 124,23.0,4.0,None,Neutral,2024-12-08 12:02:05.883165,40
stockmarket,capital gains loophole question,22.0,30.0,None,Positive,2024-12-08 12:02:05.883245,31
stockmarket,these are the stocks on my watchlist 123,17.0,20.0,None,Neutral,2024-12-08 12:02:05.883327,40
stockmarket,these are the stocks on my watchlist 126,13.0,15.0,None,Neutral,2024-12-08 12:02:05.883407,40
stockmarket,a short critique of ray dalio,11.0,8.0,None,Neutral,2024-12-08 12:02:05.883487,29
stockmarket,sava thoughts,12.0,13.0,None,Neutral,2024-12-08 12:02:05.883568,13
stockmarket,looking at japans mineral discovery and the effect on ev and chip stocks,11.0,8.0,None,Neutral,2024-12-08 12:02:05.883652,72
stockmarket,these are the stocks on my watchlist 122,9.0,8.0,None,Neutral,2024-12-08 12:02:05.883732,40
stockmarket,seeking feedback on my 200k investment strategy at 24,8.0,36.0,None,Neutral,2024-12-08 12:02:05.883815,53
stockmarket,raytheon awarded 13 billion navy  dod contract just now rtx,8.0,2.0,$RTX,Neutral,2024-12-08 12:02:05.883897,59
stockmarket,delight in bombay halwa  soft chewy and bursting with authentic flavors freshly made and delivered next day  order now from the modern village,71.0,6.0,None,Neutral,2024-12-08 12:02:05.884798,142
stockmarket,devon energy  checking if i am missing anything,6.0,5.0,None,Neutral,2024-12-08 12:02:05.884890,47
stockmarket,anyone else buying the nu dip,4.0,34.0,None,Positive,2024-12-08 12:02:05.884975,29
finance,powell says hes not worried about the fed losing its independence under trump,1178.0,107.0,None,Neutral,2024-12-08 12:02:18.460930,77
finance,bitcoin is at all time high ready to trade in crypto  start your crypto trading journey with confidence on coindcx  learn karo crypto karo,2.0,0.0,None,Neutral,2024-12-08 12:02:18.461063,138
finance,tesla ceo elon musk loses bid to get 56 billion pay package reinstated,1019.0,111.0,None,Neutral,2024-12-08 12:02:18.461182,70
finance,unchecked corporate pricing power is a factor in us inflation,852.0,156.0,None,Neutral,2024-12-08 12:02:18.461297,61
finance,art cashin new york stock exchange fixture for decades dies at age 83,27.0,11.0,None,Neutral,2024-12-08 12:02:18.461411,69
finance,ugoopyteacher explains how the health insurance mafia has manipulated the market for healthcare to continually jack up prices,18.0,0.0,None,Neutral,2024-12-08 12:02:18.461530,125
finance,moronic monday  december 02 2024  your weekly questions thread,1.0,12.0,None,Neutral,2024-12-08 12:02:18.461644,62
cryptocurrency,hawk tuah girl responds as people call for her to be jailed with fans losing life savings after buying her cryptocurrency,71.0,4985.0,None,Positive,2024-12-08 12:02:56.496272,121
cryptocurrency,bitcoin is at all time high ready to trade in crypto  start your crypto trading journey with confidence on coindcx  learn karo crypto karo,2.0,0.0,None,Neutral,2024-12-08 12:02:56.496368,138
cryptocurrency,on february 9th 2011 bitcoin first touched 1 less than 14 years later bitcoin has surpassed 100k an increase of 10 million percent,7721.0,487.0,None,Neutral,2024-12-08 12:02:56.496460,130
cryptocurrency,hawk tuah girl is being investigated by law firms over possible lawsuit as fans lose life savings after buying her cryptocurrency,6546.0,768.0,None,Positive,2024-12-08 12:02:56.496549,129
cryptocurrency,bitcoins officially hits 100000 for the first time ever,3863.0,500.0,None,Neutral,2024-12-08 12:02:56.496634,55
cryptocurrency,man narrows landfill search for 771 million bitcoin hard drive with finely tuned plan,3508.0,574.0,None,Neutral,2024-12-08 12:02:56.496720,85
cryptocurrency,the hawk tuah girl committed a horrible crime not calling her crypto spitcoin,2757.0,207.0,None,Neutral,2024-12-08 12:02:56.496806,77
cryptocurrency,in 2018 on hitbtc i purchased many different coins including 2000 dogecoins and was going to get them out in 10 years hitbtc took them all,2124.0,493.0,None,Neutral,2024-12-08 12:02:56.496896,138
cryptocurrency,us gov told banks to suppress crypto coinbase documents show,1838.0,207.0,None,Neutral,2024-12-08 12:02:56.496982,60
cryptocurrency,bitcoin sudden drop to 93k wipes out 303m of longs within minutes,1824.0,205.0,None,Neutral,2024-12-08 12:02:56.497069,65
cryptocurrency,us government has started to move 336m worth of eth busd shib and other coins to a new wallet they also continue to hold mammoth of 1981k btc 1892b,1647.0,369.0,None,Neutral,2024-12-08 12:02:56.497161,147
cryptocurrency,the famous hawk tuah girl haliey welchs hawk memecoin has sparked controversy as its price dumps over 90 within hours one of the key reasons behind hawk price crashing was a finding of alleged snipers and insiders,1556.0,345.0,None,Negative,2024-12-08 12:02:56.497258,213
cryptocurrency,beware of these youtubers their top comments are all bots,1549.0,242.0,None,Neutral,2024-12-08 12:02:56.497344,57
cryptocurrency,never miss another trade accurate trading signals 7day free trial,2464.0,0.0,None,Neutral,2024-12-08 12:02:56.497435,65
cryptocurrency,534 billion in bitcoin withdrawn from exchanges in 72 hours,1531.0,162.0,None,Neutral,2024-12-08 12:02:56.497519,59
cryptocurrency,donald trump officially selects procrypto paul atkins to replace gary gensler as sec chair,1515.0,187.0,None,Neutral,2024-12-08 12:02:56.497605,90
cryptocurrency,we need to have a serious talk about marketcaps,1399.0,712.0,None,Neutral,2024-12-08 12:02:56.497683,47
cryptocurrency,dormant bitcoin whale transfers 2700 btc he received bitcoins back in 2013 when price was only 625 the current value skyrocketed to 277m almost 15300 gain,1305.0,210.0,None,Positive,2024-12-08 12:02:56.497765,154
cryptocurrency,bitcoin crashes to 62000 on upbit after south korea enacts emergency martial law,1288.0,158.0,None,Negative,2024-12-08 12:02:56.497844,80
cryptocurrency,microstrategy has acquired another 15400 btc for 15 billion they now hold 402100 btc acquired for 234 billion saylor quotes the only thing better than bitcoin is more bitcoin,1239.0,252.0,None,Neutral,2024-12-08 12:02:56.497929,174
cryptocurrency,eth price hits 9month high surpasses 4000 mark,1232.0,219.0,None,Neutral,2024-12-08 12:02:56.498007,46
cryptocurrency,us government transfers bitcoin worth 2 billion to coinbase,1165.0,159.0,None,Neutral,2024-12-08 12:02:56.498085,59
cryptocurrency,always remember we aint sheep we know whats coming,1114.0,728.0,None,Neutral,2024-12-08 12:02:56.498161,50
cryptocurrency,is today the day of q4 2021,1110.0,127.0,None,Neutral,2024-12-08 12:02:56.498238,27
cryptocurrency,whos laughing now  nyc mayor received bitcoin paychecks and says we should not be afraid of bitcoin,1109.0,186.0,None,Neutral,2024-12-08 12:02:56.498318,99
cryptocurrency,trust a stranger or trust worldclass security and 10 years of experience,71.0,0.0,None,Neutral,2024-12-08 12:02:56.498400,72
cryptocurrency,this altcoin season is going to make some rich and some cry like babies in the end,1102.0,559.0,None,Neutral,2024-12-08 12:02:56.498478,82
cryptocurrency,xrp becomes worlds thirdlargest crypto overtakes tethers usdt in market cap,1022.0,309.0,None,Neutral,2024-12-08 12:02:56.498557,75
algo_trading,the most profitable strategy on earth,0.0,0.0,None,Positive,2024-12-08 12:03:08.998801,37
valueinvesting,btc hits 100k while the graham approach is at an absolute low,677.0,515.0,None,Neutral,2024-12-08 12:03:22.535008,61
valueinvesting,the mother of all bubbles us markets in an unprecedented hype cycle,653.0,256.0,None,Neutral,2024-12-08 12:03:22.535281,67
valueinvesting,for those that think the market is overvalued based on historical norms,212.0,212.0,None,Neutral,2024-12-08 12:03:22.535368,71
valueinvesting,peter lynch is the real deal,191.0,66.0,None,Neutral,2024-12-08 12:03:22.535454,28
valueinvesting,how do you remain sane in an insane market,140.0,103.0,None,Neutral,2024-12-08 12:03:22.535537,42
valueinvesting,which stock is your biggest regret for not purchasing when you had the chance but thought otherwise,99.0,318.0,None,Neutral,2024-12-08 12:03:22.535629,99
valueinvesting,what has worked for me in investing,94.0,31.0,None,Neutral,2024-12-08 12:03:22.535713,35
valueinvesting,michael burry went all in on china and baba,79.0,94.0,None,Neutral,2024-12-08 12:03:22.535796,43
valueinvesting,which stocks are you keeping an eye on for a potential price drop and by what percentage would they need to dip before youd consider buying,76.0,162.0,None,Positive,2024-12-08 12:03:22.535889,139
valueinvesting,share an example of when you bought the dip and it paid off,79.0,283.0,None,Neutral,2024-12-08 12:03:22.535976,59
valueinvesting,best small cap value stocks right now,68.0,159.0,None,Neutral,2024-12-08 12:03:22.536058,37
valueinvesting,what do you think about rddt,65.0,140.0,$RDDT,Neutral,2024-12-08 12:03:22.536144,28
valueinvesting,uber and lyft were hit hard today due to waymo expansion in miami so why is googl also dropping,61.0,75.0,None,Neutral,2024-12-08 12:03:22.536236,95
valueinvesting,seeking your thoughts on my google investment,57.0,88.0,None,Neutral,2024-12-08 12:03:22.536319,45
valueinvesting,24 undervalued stocks in the sp500 nasdaq100 and dow30 your weekly guide 01 december 2024  maybe of interest,47.0,13.0,None,Neutral,2024-12-08 12:03:22.536405,108
valueinvesting,worng answers only  the stock that will outperform in 2025,45.0,217.0,None,Neutral,2024-12-08 12:03:22.536488,58
valueinvesting,intel  buy sell hold   following ceo ouster,46.0,113.0,None,Neutral,2024-12-08 12:03:22.536573,43
valueinvesting,overlooked sectors going into 2025,47.0,99.0,None,Neutral,2024-12-08 12:03:22.536655,34
valueinvesting,value stocks are stocks that are currently trading at a price lower than their actual intrinsic price,46.0,20.0,None,Neutral,2024-12-08 12:03:22.536741,101
valueinvesting,if you are invested in individual stocks and didnt overpay for them you should not worry about the overall stock market,45.0,5.0,None,Neutral,2024-12-08 12:03:22.536833,119
valueinvesting,starting with an sp index and then deleting the companies you dont like,44.0,72.0,None,Neutral,2024-12-08 12:03:22.536925,71
valueinvesting,the us and the global markets are overvalued,40.0,244.0,None,Neutral,2024-12-08 12:03:22.537008,44
valueinvesting,cheer holding chr market cap 29m buyback 50m,40.0,78.0,None,Positive,2024-12-08 12:03:22.537092,44
valueinvesting,make 250hour or 3000 per study with remote online research workjoin today,71.0,0.0,None,Neutral,2024-12-08 12:03:22.537189,73
valueinvesting,seeking your best value picks  trump presidency potential,32.0,127.0,None,Neutral,2024-12-08 12:03:22.537276,57
valueinvesting,raytheon awarded 13 billion navy  dod contract just now rtx,30.0,15.0,$RTX,Neutral,2024-12-08 12:03:22.537366,59
dividends,22m just cracked 300 annual,914.0,96.0,None,Neutral,2024-12-08 12:03:35.605068,27
dividends,10k a year milestone,611.0,80.0,None,Neutral,2024-12-08 12:03:35.605190,20
dividends,bitcoin is at all time high ready to trade in crypto  start your crypto trading journey with confidence on coindcx  learn karo crypto karo,2.0,0.0,None,Neutral,2024-12-08 12:03:35.605362,138
dividends,well dividends keep me afloat,438.0,204.0,None,Neutral,2024-12-08 12:03:35.605440,29
dividends,just hit 1k dividends,259.0,32.0,None,Neutral,2024-12-08 12:03:35.605516,21
dividends,im at least 20 years away from retiring,240.0,72.0,None,Neutral,2024-12-08 12:03:35.605593,39
dividends,4 years of dividend reinvestment,196.0,62.0,None,Neutral,2024-12-08 12:03:35.605667,32
dividends,28m military officer living overseas just hit 250k net worth mint is dead but finally found something better,147.0,36.0,None,Neutral,2024-12-08 12:03:35.605743,108
dividends,jepq first dividend,148.0,65.0,None,Neutral,2024-12-08 12:03:35.605815,19
dividends,900 a month from 122k,133.0,108.0,None,Neutral,2024-12-08 12:03:35.605887,21
dividends,38m started investing 6 year ago how am i doing,130.0,82.0,None,Neutral,2024-12-08 12:03:35.605969,47
dividends,best dividend stocks with 1mill,107.0,131.0,None,Neutral,2024-12-08 12:03:35.606041,31
dividends,schd challenge update,104.0,38.0,None,Neutral,2024-12-08 12:03:35.606113,21
dividends,which portfolio,92.0,69.0,None,Neutral,2024-12-08 12:03:35.606184,15
dividends,why are so many people against dividend investing i just cannot believe how divisive the etf community is about that hell the entire stock market community is pretty divided is there something im missing or,97.0,163.0,None,Positive,2024-12-08 12:03:35.606286,206
dividends,27m just started portfolio around 2 months ago any suggestions,66.0,51.0,None,Neutral,2024-12-08 12:03:35.606361,62
dividends,the 2024 help desk gift guide tech we tested and recommend,71.0,0.0,None,Neutral,2024-12-08 12:03:35.606451,58
dividends,what are the downsides of buying the holdings of schd,61.0,60.0,None,Positive,2024-12-08 12:03:35.606525,53
dividends,building my portfolio any advice,56.0,51.0,None,Neutral,2024-12-08 12:03:35.606597,32
dividends,proctor  gamble,57.0,29.0,None,Neutral,2024-12-08 12:03:35.606669,15
dividends,for those that are choosing individual dividend stocks over etfswhy,56.0,105.0,None,Neutral,2024-12-08 12:03:35.606747,67
dividends,best dividend etf for next 15 years or so,40.0,61.0,None,Neutral,2024-12-08 12:03:35.606820,41
dividends,first year so far,42.0,14.0,None,Neutral,2024-12-08 12:03:35.606891,17
dividends,dow up dividend etfs down ,39.0,48.0,None,Neutral,2024-12-08 12:03:35.606963,26
dividends,best dividend stock,40.0,129.0,None,Neutral,2024-12-08 12:03:35.607034,19
dividends,my dividend portfolio,40.0,10.0,None,Neutral,2024-12-08 12:03:35.607105,21
