subreddit,title,upvotes,comments,stock_tickers,sentiment,timestamp,title_length
Economics,study from oct shows trump tax plan adversely affects low income americans,646.0,77.0,None,Neutral,2024-12-08 12:05:58.512829,74
Economics,gm to write down value of china business by more than 5bn,627.0,81.0,None,Neutral,2024-12-08 12:05:58.512912,57
Economics,is this the end of the free trade era,573.0,376.0,None,Neutral,2024-12-08 12:05:58.512992,37
Economics,when it comes to price gouging  how come no one has looked at insurance companies,558.0,123.0,None,Neutral,2024-12-08 12:05:58.513076,81
Economics,fed governor waller says he is leaning toward a december rate cut but worries about inflation,544.0,181.0,None,Neutral,2024-12-08 12:05:58.513160,93
Economics,freddie mac reports 684 mortgage rate as grant cardone warns of homeownership crisis,379.0,180.0,None,Neutral,2024-12-08 12:05:58.513246,84
Economics,tariffs under first trump term hurt us firms ny fed analysis says,379.0,40.0,None,Neutral,2024-12-08 12:05:58.513327,65
Economics,gen zs financial angst underlies shift to the right,372.0,198.0,None,Neutral,2024-12-08 12:05:58.513412,51
Economics,why americas economy is soaring ahead of its rivals  financial times,348.0,340.0,None,Neutral,2024-12-08 12:05:58.513495,68
Economics,the science behind winning a nobel prize being a man from a wealthy family,404.0,45.0,None,Neutral,2024-12-08 12:05:58.513575,74
Economics,november jobs report us economy adds 227000 jobs in november unemployment rate rises to 42 as labor markets rebound,331.0,81.0,None,Neutral,2024-12-08 12:05:58.513658,115
Economics,manufacturing is a war now,320.0,127.0,None,Neutral,2024-12-08 12:05:58.513737,26
Economics,new stock exchange aiming to offer 23hour trading set to launch in 2025,293.0,46.0,None,Neutral,2024-12-08 12:05:58.513819,71
Economics,canadas jobless rate jumps to near 8year high of 68 in november,281.0,55.0,None,Neutral,2024-12-08 12:05:58.513899,63
retirement,last day last time im doing,2212.0,316.0,None,Neutral,2024-12-08 12:06:36.821168,27
retirement,bitcoin is at all time high ready to trade in crypto  start your crypto trading journey with confidence on coindcx  learn karo crypto karo,2.0,0.0,None,Neutral,2024-12-08 12:06:36.821289,138
retirement,living small new and content in retirement,279.0,106.0,None,Neutral,2024-12-08 12:06:36.821393,42
retirement,how did you get through your last year of work,109.0,367.0,None,Neutral,2024-12-08 12:06:36.821495,46
retirement,how do you handle a car purchase in retirement,87.0,379.0,None,Neutral,2024-12-08 12:06:36.821594,46
retirement,selfhelp junkies what is your routine that keeps you excited about your life,86.0,21.0,None,Neutral,2024-12-08 12:06:36.821696,76
retirement,emergency fund amount in retirement and where is the money in kept,47.0,121.0,None,Neutral,2024-12-08 12:06:36.821796,66
retirement,what is your ira spend plan in your retirement years,25.0,101.0,None,Neutral,2024-12-08 12:06:36.821894,52
retirement,how do you balance health  restaurants as part of your retirement lifestyle,19.0,80.0,None,Neutral,2024-12-08 12:06:36.821994,75
retirement,taking unemployment before retiring,18.0,53.0,None,Neutral,2024-12-08 12:06:36.822090,35
retirement,returning to work after a year or more retired,17.0,49.0,None,Neutral,2024-12-08 12:06:36.822190,46
retirement,starting over hiring my replacement,15.0,60.0,None,Neutral,2024-12-08 12:06:36.822291,35
retirement,what activities or events are you planning for the winter months,16.0,38.0,None,Neutral,2024-12-08 12:06:36.822390,64
retirement,a uk education blends worldclass teaching an amazing student experience and boosts employability anythings possible when you study in the uk,71.0,0.0,None,Neutral,2024-12-08 12:06:36.822506,140
retirement,how do you plan for bonuslike splurges in retirement,12.0,49.0,None,Neutral,2024-12-08 12:06:36.822615,52
retirement,united healthcare medicare supplement  any decent experiences,8.0,47.0,None,Neutral,2024-12-08 12:06:36.822715,61
StockMarketIndia,got so much lucky with bse,331.0,30.0,None,Neutral,2024-12-08 12:06:49.924034,26
StockMarketIndia,wordle meets trivia play todays factle,71.0,0.0,None,Neutral,2024-12-08 12:06:49.924129,38
StockMarketIndia,definition of long term investor,200.0,9.0,None,Neutral,2024-12-08 12:06:49.924217,32
StockMarketIndia,rate my portfolio  which stock would you sell out of these and why,185.0,50.0,None,Negative,2024-12-08 12:06:49.924303,66
StockMarketIndia,what is the most you have earned in one day,145.0,84.0,None,Neutral,2024-12-08 12:06:49.924387,43
StockMarketIndia,rate my portfolio and advice ,119.0,478.0,None,Neutral,2024-12-08 12:06:49.924470,29
StockMarketIndia,my relative phupagi investment in stocks,102.0,16.0,None,Neutral,2024-12-08 12:06:49.924551,40
StockMarketIndia,rate my portfolio for longterm holding,95.0,36.0,None,Neutral,2024-12-08 12:06:49.924634,38
StockMarketIndia,exactly 1 year of investing into the market,92.0,25.0,None,Neutral,2024-12-08 12:06:49.924716,43
StockMarketIndia,nifty is behaving like crypto ,86.0,21.0,None,Neutral,2024-12-08 12:06:49.924799,30
StockMarketIndia,meme but a true one on indian finance,81.0,3.0,None,Neutral,2024-12-08 12:06:49.924881,37
StockMarketIndia,i really cooked today,74.0,16.0,None,Neutral,2024-12-08 12:06:49.924962,21
StockMarketIndia,am i cooked,68.0,116.0,None,Neutral,2024-12-08 12:06:49.925042,11
StockMarketIndia,official website in india enjoy now the exclusive games,71.0,0.0,None,Neutral,2024-12-08 12:06:49.925133,55
StockMarketIndia,what is happen,54.0,43.0,None,Neutral,2024-12-08 12:06:49.925213,14
StockMarketIndia,bank ac vs stock ac,53.0,27.0,None,Neutral,2024-12-08 12:06:49.925294,19
StockMarketIndia,rate my portfolio for next 5 years,48.0,35.0,None,Neutral,2024-12-08 12:06:49.925374,34
StockMarketIndia,umm what,47.0,14.0,None,Neutral,2024-12-08 12:06:49.925454,8
StockMarketIndia,south korea martial law impact,45.0,21.0,None,Neutral,2024-12-08 12:06:49.925535,30
StockMarketIndia,rate my portfolio 19m,39.0,29.0,None,Neutral,2024-12-08 12:06:49.925616,21
StockMarketIndia,how fud i am ,38.0,69.0,None,Neutral,2024-12-08 12:06:49.925698,13
StockMarketIndia,what do you guys think,39.0,25.0,None,Neutral,2024-12-08 12:06:49.925778,22
StockMarketIndia,will gdp affect market tomorrow,36.0,50.0,None,Neutral,2024-12-08 12:06:49.925859,31
StockMarketIndia,i planned to double but nvm,34.0,3.0,None,Neutral,2024-12-08 12:06:49.925939,27
StockMarketIndia,will it hit 600 in two months,32.0,33.0,None,Neutral,2024-12-08 12:06:49.926020,29
StockMarketIndia,rate my portfolio,32.0,39.0,None,Neutral,2024-12-08 12:06:49.926100,17
StockMarketIndia,nifty50 expiry today,28.0,2.0,None,Neutral,2024-12-08 12:06:49.926180,20
StockAnalysis,alibaba update lowering our fair value estimate due to cloud unit disclosures and increased uncertainty,1.0,0.0,None,Neutral,2024-12-08 12:07:15.678377,103
microcapstocks,wfld  realistic assessment of wellfield technologies,0.0,0.0,$WFLD,Neutral,2024-12-08 12:07:28.622965,52
spacs,ama43  ftacfld bitcoin financial services firm w betsy cohen  will reeves ceo,8.0,9.0,"$FTAC, $FLD",Neutral,2024-12-08 12:07:41.891821,77
spacs,taken down by his own consciouslmao,71.0,0.0,None,Neutral,2024-12-08 12:07:41.891957,35
spacs,ionq unveils its first quantum computer in europe online now at a record aq36,6.0,2.0,None,Neutral,2024-12-08 12:07:41.892078,77
spacs,announcements x daily discussion for wednesday december 04 2024,3.0,10.0,None,Neutral,2024-12-08 12:07:41.892194,63
spacs,announcements x daily discussion for tuesday december 03 2024,4.0,18.0,None,Neutral,2024-12-08 12:07:41.892310,61
spacs,announcements x daily discussion for monday december 02 2024,2.0,24.0,None,Neutral,2024-12-08 12:07:41.892425,60
spacs,announcements x daily discussion for friday december 06 2024,2.0,20.0,None,Neutral,2024-12-08 12:07:41.892540,60
spacs,spac trust account withdrawals and tax receivables an overlooked opportunity,2.0,3.0,None,Positive,2024-12-08 12:07:41.892658,76
spacs,announcements x daily discussion for weekend of december 07 2024,1.0,6.0,None,Neutral,2024-12-08 12:07:41.892774,64
spacs,lotus tech ready for a rebound,1.0,0.0,None,Neutral,2024-12-08 12:07:41.892887,30
spacs,evtl 2x warrant dilutiion,1.0,12.0,None,Neutral,2024-12-08 12:07:41.893000,25
spacs,announcements x daily discussion for thursday december 05 2024,1.0,14.0,None,Neutral,2024-12-08 12:07:41.893115,62
CryptoCurrencyTrading,dwf labs unveils 20m investment fund for meme coin innovators,39.0,10.0,None,Neutral,2024-12-08 12:07:54.772689,61
CryptoCurrencyTrading,ai crypto projects by revenue how does origintrail trac compare,38.0,19.0,$TRAC,Neutral,2024-12-08 12:07:54.772816,63
CryptoCurrencyTrading,ai projects with real revenue,16.0,4.0,None,Neutral,2024-12-08 12:07:54.772936,29
CryptoCurrencyTrading,what is xrp and what is elon musks relation with ripple,6.0,2.0,None,Neutral,2024-12-08 12:07:54.773058,55
CryptoCurrencyTrading,who are the experts,4.0,4.0,None,Neutral,2024-12-08 12:07:54.773171,19
CryptoCurrencyTrading,take five crypto gain europe pain,2.0,0.0,None,Positive,2024-12-08 12:07:54.773287,33
CryptoCurrencyTrading,the month bitcoin shattered records  dive into the bitcoin report,2.0,0.0,None,Neutral,2024-12-08 12:07:54.773406,65
CryptoCurrencyTrading,crypto kingpin alex mashinsky pleads guilty,2.0,0.0,None,Neutral,2024-12-08 12:07:54.773521,43
CryptoCurrencyTrading,xrp holders does this breakdown bother you,2.0,5.0,None,Neutral,2024-12-08 12:07:54.773634,42
CryptoCurrencyTrading,inside charles hoskinsons quantum hosky project,2.0,0.0,None,Neutral,2024-12-08 12:07:54.773750,47
CryptoCurrencyTrading,is there a better way to analyze crypto tokens my journey with pe ratios in crypto investments,1.0,2.0,None,Neutral,2024-12-08 12:07:54.773869,94
CryptoCurrencyTrading,grimezai confirmed as ai16z dao contributor ai16z ceo previously worked with grimes could get interesting,1.0,0.0,$GRIME,Neutral,2024-12-08 12:07:54.773989,105
CryptoCurrencyTrading,cryptocurrencytrading,1.0,0.0,None,Neutral,2024-12-08 12:07:54.774101,21
CryptoCurrencyTrading,mikawa inu shikoku keeps going higher,0.0,1.0,None,Neutral,2024-12-08 12:07:54.774218,37
CryptoCurrencyTrading,who wants to become a trading partner,0.0,8.0,None,Neutral,2024-12-08 12:07:54.774332,37
mutualfunds,my portfolio at 23 years old,1104.0,139.0,None,Neutral,2024-12-08 12:08:20.194826,28
mutualfunds,another personal milestone reached 10l,567.0,74.0,None,Neutral,2024-12-08 12:08:20.194967,38
mutualfunds,been warning everyone chasing active midcap,319.0,76.0,None,Neutral,2024-12-08 12:08:20.195063,43
mutualfunds,roast my mf sips,105.0,32.0,None,Neutral,2024-12-08 12:08:20.195153,16
mutualfunds,heres why smallcap 250 is trash,99.0,17.0,None,Neutral,2024-12-08 12:08:20.195248,31
mutualfunds,reached a small milestone,95.0,24.0,None,Neutral,2024-12-08 12:08:20.195341,25
mutualfunds,rate my investments,86.0,15.0,None,Neutral,2024-12-08 12:08:20.195430,19
mutualfunds,my 25 year old portfolio,81.0,41.0,None,Neutral,2024-12-08 12:08:20.195525,24
mutualfunds,my portfolio is reaching 30l this month swipe left to see my sips what improvements would you suggest,78.0,44.0,None,Neutral,2024-12-08 12:08:20.195620,101
mutualfunds,why is parag parikh flexi cap fund so popular on reddit there are quite a few strong and historically better perfomers that are going unnoticed am i missing comething crucial,76.0,52.0,None,Neutral,2024-12-08 12:08:20.195716,174
mutualfunds,10l milestone,62.0,15.0,None,Neutral,2024-12-08 12:08:20.195807,13
mutualfunds,my portfolio at 28y,51.0,2.0,None,Neutral,2024-12-08 12:08:20.195902,19
mutualfunds,fund in dematfolio,48.0,32.0,None,Neutral,2024-12-08 12:08:20.195992,18
mutualfunds,i have 10 lakh to invest,49.0,55.0,None,Neutral,2024-12-08 12:08:20.196081,24
mutualfunds,is it okay to keep all your savings in mutual funds,46.0,21.0,None,Neutral,2024-12-08 12:08:20.196171,51
mutualfunds,financial freedom goal,44.0,10.0,None,Neutral,2024-12-08 12:08:20.196264,22
mutualfunds,motilal oswal mdcap and ppfc funds in every other reddit ops dashboard,45.0,31.0,None,Neutral,2024-12-08 12:08:20.196359,70
mutualfunds,et money update,39.0,45.0,None,Neutral,2024-12-08 12:08:20.196448,15
mutualfunds,first time everythings green ,34.0,15.0,None,Neutral,2024-12-08 12:08:20.197271,29
mutualfunds,my portfolio after 25 years of investing,36.0,15.0,None,Neutral,2024-12-08 12:08:20.197371,40
mutualfunds,updated my sips,33.0,18.0,None,Neutral,2024-12-08 12:08:20.197459,15
mutualfunds,annual lumpsum  10 nifty 50 drawdown vs monthly sip,34.0,10.0,None,Neutral,2024-12-08 12:08:20.197551,51
mutualfunds,my mutual funds journey,30.0,27.0,None,Neutral,2024-12-08 12:08:20.197640,23
mutualfunds,are there some factors that most people ignore about sip,30.0,25.0,None,Neutral,2024-12-08 12:08:20.197732,56
mutualfunds,why dont people here not suggesting motilal sp 500 with volatile indian market isnt it much better,28.0,18.0,None,Neutral,2024-12-08 12:08:20.197831,98
HFT,how to join a hft firm,1.0,2.0,None,Neutral,2024-12-08 12:08:32.757847,22
