subreddit,title,upvotes,comments,stock_tickers,sentiment,timestamp,title_length
dividends,100 dividend investing at 27,33.0,42.0,None,Neutral,2024-12-08 12:03:35.607177,28
daytrading,full time retail trader 10 years ama,666.0,615.0,None,Neutral,2024-12-08 12:03:49.011687,36
daytrading,bitcoin is at all time high ready to trade in crypto  start your crypto trading journey with confidence on coindcx  learn karo crypto karo,3.0,0.0,None,Neutral,2024-12-08 12:03:49.011785,138
daytrading,just made 3500 dollars on the difference between buy and sell,511.0,150.0,None,Neutral,2024-12-08 12:03:49.011873,61
daytrading,oops i did it again 2000 month,363.0,292.0,None,Positive,2024-12-08 12:03:49.011961,30
daytrading,you are not in the prediction business you are in the risk business,316.0,41.0,None,Negative,2024-12-08 12:03:49.012046,67
daytrading,was there any way to foresee this huge spike in price,240.0,143.0,None,Neutral,2024-12-08 12:03:49.012133,53
daytrading,turned a 20 loss into a 300 loss,181.0,81.0,None,Negative,2024-12-08 12:03:49.012216,32
daytrading,what am i doing wrong keep falling for false breakouts,178.0,197.0,None,Neutral,2024-12-08 12:03:49.012302,54
daytrading,the 99 of traders fail is a fake statistic,170.0,116.0,None,Neutral,2024-12-08 12:03:49.012386,42
daytrading,someone please tell me what i did wrong here,156.0,226.0,None,Neutral,2024-12-08 12:03:49.012471,44
daytrading,this is why risk management is important,159.0,35.0,None,Negative,2024-12-08 12:03:49.012556,40
daytrading,thoughts,136.0,38.0,None,Neutral,2024-12-08 12:03:49.012648,8
daytrading,not profitable try this,139.0,43.0,None,Positive,2024-12-08 12:03:49.012735,23
daytrading,never miss another trade accurate trading signals 7day free trial,2463.0,0.0,None,Neutral,2024-12-08 12:03:49.012825,65
daytrading,might be profitable after 6 years accidentally,134.0,80.0,None,Positive,2024-12-08 12:03:49.012909,46
daytrading,1700 profit 10 minute pre market scalping,124.0,112.0,None,Positive,2024-12-08 12:03:49.012994,41
daytrading,you dont need crazy high win rates and risktorewards,116.0,79.0,None,Negative,2024-12-08 12:03:49.013080,52
daytrading,what was my mistake,113.0,238.0,None,Neutral,2024-12-08 12:03:49.013164,19
daytrading,how do you think 24 hour markets will affect daytrading,113.0,120.0,None,Neutral,2024-12-08 12:03:49.013248,55
daytrading,you can be profitable with a negative win  ratio as long as you manage your risk,99.0,24.0,None,Neutral,2024-12-08 12:03:49.013335,80
daytrading,my first profitable month what adjustments i made,99.0,49.0,None,Positive,2024-12-08 12:03:49.013421,49
daytrading,for those of you that get burned with false breakouts,93.0,64.0,None,Neutral,2024-12-08 12:03:49.013506,53
daytrading,current goal just be green,86.0,52.0,None,Neutral,2024-12-08 12:03:49.013588,26
daytrading,got scared for life never shorting these chinese pds ever again,78.0,82.0,None,Positive,2024-12-08 12:03:49.013674,63
daytrading,you cant escape losses nobody can,72.0,25.0,None,Negative,2024-12-08 12:03:49.013756,33
daytrading,stay ahead of global events with micro fx futures and seize opportunities driven by macroeconomic factors,71.0,0.0,None,Neutral,2024-12-08 12:03:49.013847,105
daytrading,why did i get stopped out here,66.0,55.0,None,Neutral,2024-12-08 12:03:49.013932,30
daytrading,learned how to read level 2 and now im up over 9 my biggest profitable trading day,63.0,42.0,None,Positive,2024-12-08 12:03:49.014019,82
pennystocks,which stock are you most proud of buying at the right time,388.0,376.0,None,Positive,2024-12-08 12:04:02.348375,58
pennystocks,bitcoin is at all time high ready to trade in crypto  start your crypto trading journey with confidence on coindcx  learn karo crypto karo,2.0,0.0,None,Neutral,2024-12-08 12:04:02.348473,138
pennystocks,kulr is the future strategic bitcoin play could make this penny stock a multibagger,206.0,131.0,None,Neutral,2024-12-08 12:04:02.348564,83
pennystocks,for you kulr nerds out there like me kulr just got cooler,195.0,181.0,None,Neutral,2024-12-08 12:04:02.348652,57
pennystocks,convince me not to put 100k into caba on monday,138.0,145.0,None,Neutral,2024-12-08 12:04:02.348739,47
pennystocks,sharing my penny stocks in focus kulr mynz boltcn optt kdly and their potential,112.0,103.0,None,Neutral,2024-12-08 12:04:02.348826,79
pennystocks,done well this year time to ramp it up in 25 ,105.0,93.0,None,Neutral,2024-12-08 12:04:02.348914,45
pennystocks,first week of december watchlist i have a good feeling about 2025,77.0,61.0,None,Neutral,2024-12-08 12:04:02.349002,65
pennystocks,buying beat up stocks for january profits prso skyx nb inbs atlx,77.0,16.0,"$PRSO, $SKYX, $NB, $INBS, $ATLX",Positive,2024-12-08 12:04:02.349095,64
pennystocks,my top 7 penny stocks to watch now kulr mynz boltcn optt kdly  more highrisk highreward picks for 2024,70.0,78.0,None,Negative,2024-12-08 12:04:02.349185,102
pennystocks,great news for eltp,64.0,18.0,None,Neutral,2024-12-08 12:04:02.349267,19
pennystocks,antimony stocks about to break out ,64.0,68.0,None,Neutral,2024-12-08 12:04:02.349354,35
pennystocks,kdly a 7m mc penny stock backed by a 600 billion dollar company more,61.0,43.0,$KDLY,Neutral,2024-12-08 12:04:02.349441,68
pennystocks,i wrote the post last month on optt before it blew up  just following through,59.0,28.0,None,Neutral,2024-12-08 12:04:02.349528,77
pennystocks,never miss another trade accurate trading signals 7day free trial,2465.0,0.0,None,Neutral,2024-12-08 12:04:02.349619,65
pennystocks,december 6 2024 sharing my stock updates on my watchlist and key developments for each,57.0,37.0,None,Neutral,2024-12-08 12:04:02.349706,86
pennystocks,10 bagger potential buyout likely akts be smart tight sl,52.0,32.0,$AKTS,Positive,2024-12-08 12:04:02.349791,56
pennystocks,rgti a quantum leap for investors,55.0,69.0,None,Neutral,2024-12-08 12:04:02.349875,33
pennystocks,kulr vs mvst quick information,52.0,56.0,"$KULR, $MVST",Neutral,2024-12-08 12:04:02.349960,30
pennystocks,ampx ,52.0,18.0,None,Neutral,2024-12-08 12:04:02.350044,5
pennystocks,are we witnessing overhyped markets or are we seeing new global giants beginning their journey to greatness,44.0,101.0,None,Neutral,2024-12-08 12:04:02.350135,107
pennystocks,clover health is about to explode in 2025,42.0,33.0,None,Neutral,2024-12-08 12:04:02.350221,41
pennystocks,youre going to think back to this post 35 years from now wishing you just put in a little extra attention to gorilla technology inc grrr,40.0,41.0,$GRRR,Neutral,2024-12-08 12:04:02.350311,136
pennystocks, cvgi  a trump infrastructure play thats being slept on insiders buying,36.0,50.0,$CVGI,Positive,2024-12-08 12:04:02.350403,71
pennystocks,do any of you day trade penny stocks for a living,31.0,71.0,None,Neutral,2024-12-08 12:04:02.350489,49
pennystocks,military metals corp cse mili otcqb milif today china bans export of key minerals to us as trade frictions escalate,30.0,32.0,None,Neutral,2024-12-08 12:04:02.350577,115
pennystocks,delight in bombay halwa  soft chewy and bursting with authentic flavors freshly made and delivered next day  order now from the modern village,71.0,6.0,None,Neutral,2024-12-08 12:04:02.351205,142
pennystocks,wksp worksport,29.0,42.0,$WKSP,Neutral,2024-12-08 12:04:02.351297,14
options,assuming a 3040 drop in the market starts in january  which puts would make you a millionaire,397.0,637.0,None,Neutral,2024-12-08 12:04:15.222636,93
options,we built what we needed free way to find accessible games built by disabled gamers free forever waitlist open,71.0,0.0,None,Neutral,2024-12-08 12:04:15.222737,109
options,im out closed all positions except leaps,162.0,165.0,None,Neutral,2024-12-08 12:04:15.222822,40
options,lost my whole port today,152.0,355.0,None,Neutral,2024-12-08 12:04:15.222904,24
options,amzn free money glitch,81.0,59.0,$AMZN,Neutral,2024-12-08 12:04:15.222986,22
options,where do you turn for solid options picks,68.0,73.0,None,Neutral,2024-12-08 12:04:15.223068,41
options,mstr 400 leaps beaten up by iv contraction,71.0,63.0,None,Neutral,2024-12-08 12:04:15.223149,42
options,leaps trading dilemma take profits now or ride the longterm wave,41.0,47.0,None,Positive,2024-12-08 12:04:15.223227,64
options,cheap calls puts and earnings plays for this week,41.0,13.0,None,Neutral,2024-12-08 12:04:15.223303,49
options,i cant cope huge options loss,36.0,222.0,None,Negative,2024-12-08 12:04:15.223378,29
options,did i just make 1k in 7 minutes selling a 0dte otm 390p csp on applovin app,31.0,58.0,$APP,Negative,2024-12-08 12:04:15.223455,75
options,look for some good leaps to buy that expire 2026,29.0,114.0,None,Positive,2024-12-08 12:04:15.223531,48
options,best dte for selling puts,26.0,69.0,None,Negative,2024-12-08 12:04:15.223605,25
options,make 250hour or 3000 per study with remote online research workjoin today,71.0,0.0,None,Neutral,2024-12-08 12:04:15.223691,73
options,bro this is tough missing everything on nvidia options this week,25.0,35.0,None,Neutral,2024-12-08 12:04:15.223766,64
options,happy monday happy december,23.0,30.0,None,Neutral,2024-12-08 12:04:15.223841,27
options,option tools i used in 2024,18.0,19.0,None,Neutral,2024-12-08 12:04:15.223914,27
options,roast my trade short spy for a drop tomorrow,17.0,50.0,None,Neutral,2024-12-08 12:04:15.223989,44
options,selling covered calls monthly or yearly,17.0,32.0,None,Negative,2024-12-08 12:04:15.224066,39
options,just found out about covered calls,14.0,127.0,None,Neutral,2024-12-08 12:04:15.224140,34
options,fixing covered calls,17.0,23.0,None,Neutral,2024-12-08 12:04:15.224212,20
options,is selling cash covered puts on the money for smci safe 7 premium for 35 day contracts,14.0,54.0,None,Negative,2024-12-08 12:04:15.224288,86
options,profit mechanisms for options trading,17.0,9.0,None,Positive,2024-12-08 12:04:15.224362,37
options,bitcoin euphoria threatens to break these etfs,13.0,18.0,None,Neutral,2024-12-08 12:04:15.224435,46
options,selling covered calls on nvda,12.0,47.0,None,Negative,2024-12-08 12:04:15.224508,29
options,our forex trading course is free to sign up for a limited time only grab your lifetime access today offer ends 31 december 2024,71.0,0.0,None,Neutral,2024-12-08 12:04:15.224593,127
options,grrrrrreeks,12.0,20.0,None,Neutral,2024-12-08 12:04:15.224666,11
options,2k to invest in callsputs,12.0,68.0,None,Neutral,2024-12-08 12:04:15.224738,25
FIRE,900k at 40 years old,869.0,202.0,None,Neutral,2024-12-08 12:04:28.663942,20
FIRE,bitcoin is at all time high ready to trade in crypto  start your crypto trading journey with confidence on coindcx  learn karo crypto karo,3.0,0.0,None,Neutral,2024-12-08 12:04:28.664035,138
FIRE,many of us are using re fantasies to avoid problems we could solve today,493.0,160.0,None,Neutral,2024-12-08 12:04:28.664121,72
FIRE,hit 100k in my roth today,435.0,58.0,None,Neutral,2024-12-08 12:04:28.664203,25
FIRE,375k at 33 years old tired and hitting savings fatigue,393.0,252.0,None,Neutral,2024-12-08 12:04:28.664285,54
FIRE,im mentally going crazy seeing stocks reaching aths and i sold 150k from my portfolio 2 years ago to buy a condo thats gone down in value ,397.0,331.0,None,Positive,2024-12-08 12:04:28.664377,138
FIRE,years of savings has made me very frugal,352.0,232.0,None,Neutral,2024-12-08 12:04:28.664459,40
FIRE,hit my number same week i got laid off,314.0,157.0,None,Neutral,2024-12-08 12:04:28.664539,38
FIRE,35m milestone,277.0,101.0,None,Neutral,2024-12-08 12:04:28.664617,13
FIRE,i hit 200k in my personal savings and investments at 28m,271.0,47.0,None,Neutral,2024-12-08 12:04:28.664704,56
FIRE,i was shocked how much social security i qualify for despite planning for early 30s retirement,262.0,203.0,None,Neutral,2024-12-08 12:04:28.664789,94
FIRE,milestones,259.0,50.0,None,Neutral,2024-12-08 12:04:28.664870,10
FIRE,re one year later  my perspective,194.0,27.0,None,Neutral,2024-12-08 12:04:28.664950,33
FIRE,taken down by his own consciouslmao,71.0,0.0,None,Neutral,2024-12-08 12:04:28.665044,35
FIRE,can i retire with 12m at 44,190.0,222.0,None,Neutral,2024-12-08 12:04:28.665124,27
FIRE,passed 1m nw,186.0,51.0,None,Neutral,2024-12-08 12:04:28.665204,12
FIRE,15m at 40 wooho and thank you,162.0,34.0,None,Neutral,2024-12-08 12:04:28.665285,29
FIRE,did the fire movement only occur due to corporation moving away from standard pensions 30 years ago,142.0,181.0,None,Neutral,2024-12-08 12:04:28.665368,99
FIRE,kids these days,130.0,115.0,None,Neutral,2024-12-08 12:04:28.665447,15
FIRE,healthcare worker hit 13 m in net worth,134.0,95.0,None,Neutral,2024-12-08 12:04:28.665529,39
FIRE,60 gain in sp 500 in last 2 years,114.0,136.0,None,Positive,2024-12-08 12:04:28.665608,33
FIRE,trying to get laid off,105.0,78.0,None,Neutral,2024-12-08 12:04:28.665688,22
FIRE,the lost decade,101.0,77.0,None,Neutral,2024-12-08 12:04:28.665766,15
FIRE,fire has altered my outlook on work hurting my productivity looking for advice,94.0,50.0,None,Neutral,2024-12-08 12:04:28.665848,78
FIRE,finally hit my goal 3m  paid off home would like a second set of eyes,91.0,93.0,None,Neutral,2024-12-08 12:04:28.665930,69
FIRE,how dependent is your plan on aca,92.0,192.0,None,Neutral,2024-12-08 12:04:28.666011,33
FIRE,hit 1m nw at 36 yo married with kids,86.0,22.0,None,Neutral,2024-12-08 12:04:28.666092,36
IndiaInvestments,my brother in law wants to invest 60l to get regular income,184.0,65.0,None,Neutral,2024-12-08 12:04:53.780043,59
IndiaInvestments,im 37 years old with all of my investment only in the form of fds of various banks please help,174.0,76.0,None,Neutral,2024-12-08 12:04:53.780161,94
IndiaInvestments,as a long term investor in india do you wonder about issues with infrastructure norms pollution corruption causing a crash in the future,77.0,31.0,None,Negative,2024-12-08 12:04:53.780274,136
IndiaInvestments,how would you use an amount of around 15 cr if you had it,56.0,97.0,None,Neutral,2024-12-08 12:04:53.780376,57
IndiaInvestments,insurance company deducting amount from second claim due to their own error in first claim  need advice,14.0,19.0,None,Neutral,2024-12-08 12:04:53.780506,103
IndiaInvestments,have two questions in context of motilal oswal s  p index fund investment,4.0,5.0,None,Neutral,2024-12-08 12:04:53.780609,73
IndiaInvestments,biweekly advice thread december 01 2024 all your personal queries,1.0,41.0,None,Neutral,2024-12-08 12:04:53.780713,65
IndiaInvestments,reviews of banking services  products thread for december 2024  request or post reviews here,1.0,2.0,None,Neutral,2024-12-08 12:04:53.780820,92
IndiaInvestments,unable to change bank details in groww app via mf central website,0.0,4.0,None,Neutral,2024-12-08 12:04:53.780922,65
IndiaInvestments,how do former nris manage finances abroad remotely after return to india,0.0,0.0,None,Neutral,2024-12-08 12:04:53.781024,72
IndiaInvestments,can a nri return to india and retire comfortably with a 1 million dollars,0.0,6.0,None,Neutral,2024-12-08 12:04:53.781126,73
Trading,i want to trade for a living so done with my sales role,151.0,83.0,None,Neutral,2024-12-08 12:05:06.703576,55
Trading,bitcoin is at all time high ready to trade in crypto  start your crypto trading journey with confidence on coindcx  learn karo crypto karo,3.0,0.0,None,Neutral,2024-12-08 12:05:06.703681,138
Trading,any trading youtube channel where the guru doesnt sell you a course,110.0,180.0,None,Negative,2024-12-08 12:05:06.703767,67
Trading,74 win rate without stop loss,103.0,60.0,None,Negative,2024-12-08 12:05:06.703849,29
Trading,trading by gut feeling is underrated,90.0,48.0,None,Neutral,2024-12-08 12:05:06.703931,36
Trading,most pro traders didnt go to college,39.0,111.0,None,Neutral,2024-12-08 12:05:06.704013,36
Trading,got a trading strategies while in fulltime job,33.0,55.0,None,Neutral,2024-12-08 12:05:06.704094,46
Trading,what is the most money you made in one day trading,29.0,126.0,None,Neutral,2024-12-08 12:05:06.704175,50
Trading,how to get started with trading,28.0,30.0,None,Neutral,2024-12-08 12:05:06.704256,31
Trading,how much of success in trading stocks is based on luck,19.0,60.0,None,Neutral,2024-12-08 12:05:06.704337,54
Trading,tips for the young ones,17.0,21.0,None,Neutral,2024-12-08 12:05:06.704417,23
Trading,dont scalp if you dont have patience price action not price patterns will win,13.0,9.0,None,Neutral,2024-12-08 12:05:06.704500,77
Trading,36 win ratio,11.0,16.0,None,Neutral,2024-12-08 12:05:06.704579,12
Trading,never miss another trade accurate trading signals 7day free trial,2463.0,0.0,None,Neutral,2024-12-08 12:05:06.704668,65
Trading,give advices for a wannabe trader,12.0,30.0,None,Neutral,2024-12-08 12:05:06.704749,33
Trading,beginner,10.0,18.0,None,Neutral,2024-12-08 12:05:06.704827,8
Trading,lets talk strategies lessons and staying in the game,9.0,12.0,None,Neutral,2024-12-08 12:05:06.704913,52
Trading,whats the one forex myth you believed that cost you money,9.0,10.0,None,Neutral,2024-12-08 12:05:06.704996,57
Trading,why was xauusd so choppy the past week,10.0,9.0,None,Neutral,2024-12-08 12:05:06.705077,38
Trading,are we already in the bull run,9.0,40.0,None,Neutral,2024-12-08 12:05:06.705158,30
Trading,need of trading friends,8.0,4.0,None,Neutral,2024-12-08 12:05:06.705238,23
Trading,can someone explain this please how are traders forced out,6.0,13.0,None,Neutral,2024-12-08 12:05:06.705319,58
Trading,drinking and trading,3.0,46.0,None,Neutral,2024-12-08 12:05:06.705399,20
Trading,anyone know of any trading groups i can join,6.0,10.0,None,Neutral,2024-12-08 12:05:06.705480,44
Trading,how do i start trading and on which platforms,4.0,6.0,None,Neutral,2024-12-08 12:05:06.705564,45
Trading,ready to pursue your nursing education with sophias nursing pathway there are no start dates begin anytime 100 online,71.0,0.0,None,Neutral,2024-12-08 12:05:06.705660,117
Trading,is there anyone struggling with this or its just me,5.0,47.0,None,Neutral,2024-12-08 12:05:06.705742,51
Trading,this is the dumbest thing ive seen today,4.0,4.0,None,Neutral,2024-12-08 12:05:06.705824,40
TheDividendGrowth,rdividends dividend investing,0.0,0.0,None,Neutral,2024-12-08 12:05:19.523675,29
TheDividendGrowth,rinvestingforbeginners investing for beginners no indexing or betting here,0.0,0.0,None,Neutral,2024-12-08 12:05:19.523778,74
TheDividendGrowth,rinvesting lose money with friends,0.0,0.0,None,Neutral,2024-12-08 12:05:19.523864,34
TheDividendGrowth,rclimate information about the worlds climate,0.0,0.0,None,Neutral,2024-12-08 12:05:19.523952,45
TheDividendGrowth,rqyldgang income investing,0.0,0.0,None,Neutral,2024-12-08 12:05:19.524046,26
TheDividendGrowth,rdefianceetfs defianceetfs,0.0,0.0,None,Neutral,2024-12-08 12:05:19.524128,26
TheDividendGrowth,rstocks stocks  investing and trading for all,0.0,0.0,None,Neutral,2024-12-08 12:05:19.524217,45
TheDividendGrowth,rcanadianinvestor canadian investor,0.0,0.0,None,Neutral,2024-12-08 12:05:19.524300,35
TheDividendGrowth,ueuropean_dgi,0.0,0.0,None,Neutral,2024-12-08 12:05:19.524377,13
TheDividendGrowth,udividendportfolio dividend portfolio,0.0,0.0,None,Neutral,2024-12-08 12:05:19.524450,37
TheDividendGrowth,rallcryptobets allcryptobets,0.0,0.0,None,Neutral,2024-12-08 12:05:19.524534,28
TheDividendGrowth,rfiaustralia financial independence australia,0.0,0.0,None,Neutral,2024-12-08 12:05:19.524627,45
TheDividendGrowth,rdividendgang the better dividend investing sub,0.0,0.0,None,Neutral,2024-12-08 12:05:19.524712,47
TheDividendGrowth,unavyjoe1987 joseph,0.0,0.0,None,Neutral,2024-12-08 12:05:19.524787,19
TheDividendGrowth,rcryptocurrencytrading cryptocurrency trading,0.0,0.0,None,Neutral,2024-12-08 12:05:19.524873,45
TheDividendGrowth,rcryptocurrencyico cryptocurrency  icos  crypto news and initial coin offerings updated in real time,0.0,0.0,None,Neutral,2024-12-08 12:05:19.524961,100
TheDividendGrowth,rspotcoin spotcoin  simple liquidity,0.0,0.0,None,Neutral,2024-12-08 12:05:19.525034,36
TheDividendGrowth,rzaag zaag,0.0,0.0,None,Neutral,2024-12-08 12:05:19.525120,10
TheDividendGrowth,rcryptomars crypto mars,0.0,0.0,None,Neutral,2024-12-08 12:05:19.525204,23
TheDividendGrowth,rcryptomarsshots cryptomarsshots,0.0,0.0,None,Neutral,2024-12-08 12:05:19.525289,32
TheDividendGrowth,rzim zim,0.0,0.0,None,Neutral,2024-12-08 12:05:19.525374,8
TheDividendGrowth,rico rico,0.0,0.0,None,Neutral,2024-12-08 12:05:19.525460,9
TheDividendGrowth,rm1finance m1,0.0,0.0,None,Neutral,2024-12-08 12:05:19.525553,13
TheDividendGrowth,rshitcoinmoonshots shitcoinmoonshots,0.0,0.0,None,Positive,2024-12-08 12:05:19.525640,36
TheDividendGrowth,reconomics the dismal science,0.0,0.0,None,Neutral,2024-12-08 12:05:19.525722,29
ETFs,10000 invested in vti and vxus since 1988 with all dividends reinvested,2072.0,282.0,None,Neutral,2024-12-08 12:05:32.980382,71
ETFs,built this 787k account with just 4 etfs living off 1560month in dividends early retirement starts next year,840.0,125.0,None,Neutral,2024-12-08 12:05:32.980485,108
ETFs,so powell basically just called bitcoin worthless and will never get adopted,500.0,715.0,None,Neutral,2024-12-08 12:05:32.980581,76
ETFs,shiller pe ratio is now the highest it has ever been since the dotcom bubble and vanguard has just sent out a letter to investors that vti is no longer legally classified as a diversified fund because of single stock weighting ,198.0,96.0,None,Neutral,2024-12-08 12:05:32.980868,227
ETFs,my first 1000,130.0,23.0,None,Neutral,2024-12-08 12:05:32.980970,13
ETFs,starting today adding 100 to each monthly 20 years old look good any advice,97.0,52.0,None,Neutral,2024-12-08 12:05:32.981063,75
ETFs,enough with the good sense and responsible decisions tell me about some batshit insane etfs,81.0,91.0,None,Neutral,2024-12-08 12:05:32.981154,91
ETFs,my portfolio,81.0,41.0,None,Neutral,2024-12-08 12:05:32.981244,12
ETFs,the debate is always between voo and vti why isnt the russell 1000 ever a part of this debate,69.0,50.0,None,Negative,2024-12-08 12:05:32.981338,93
ETFs,im 37m this are my holdings and i contribute annually 40k how is look for the next 15 years ahead,61.0,60.0,None,Neutral,2024-12-08 12:05:32.981432,97
ETFs,age under 50 choose from these 3 simple and fun portfolio options cast your vote,47.0,28.0,None,Neutral,2024-12-08 12:05:32.981522,80
ETFs,need advice,49.0,36.0,None,Neutral,2024-12-08 12:05:32.981610,11
ETFs,authentic kerala banana chips  crispy fresh and delivered next day  perfect for snack time order now from the modern village,272.0,36.0,None,Neutral,2024-12-08 12:05:32.981706,124
ETFs,if you had to pick two,44.0,47.0,None,Neutral,2024-12-08 12:05:32.981797,22
ETFs,looking to invest 50000 any advice,39.0,69.0,None,Neutral,2024-12-08 12:05:32.981885,34
ETFs,proof that patience is key,41.0,10.0,None,Neutral,2024-12-08 12:05:32.981975,26
ETFs,any recommendations,34.0,60.0,None,Neutral,2024-12-08 12:05:32.982062,19
ETFs,how much money should i invest in voo,33.0,71.0,None,Neutral,2024-12-08 12:05:32.982150,37
ETFs,why invest in gold,30.0,79.0,None,Neutral,2024-12-08 12:05:32.982237,18
ETFs,voo  midsmall cap etfs vs vti alone ,29.0,43.0,None,Neutral,2024-12-08 12:05:32.982326,36
ETFs,any recommendations,27.0,35.0,None,Neutral,2024-12-08 12:05:32.982414,19
ETFs,i have 800 a month to start investing but where should i start im new to investing,22.0,55.0,None,Neutral,2024-12-08 12:05:32.982506,82
ETFs,reformed individual stock pickers  what was the last straw when you turn completely to etf investing,25.0,50.0,None,Neutral,2024-12-08 12:05:32.982598,100
ETFs,i just recently switched from trying to stock pick for the last three years to finally wising up and investing in etfs ok tear apart boys lol,20.0,48.0,None,Neutral,2024-12-08 12:05:32.982695,141
ETFs,intel ceo pat gelsinger steps down as chipmakers struggles continue,71.0,0.0,None,Neutral,2024-12-08 12:05:32.982795,67
ETFs,new to etf investing,16.0,25.0,None,Neutral,2024-12-08 12:05:32.982882,20
ETFs,opinions appreciated,18.0,30.0,None,Neutral,2024-12-08 12:05:32.982970,20
InvestingIndia,trading options in indian index  icici direct  how do you win a trade and still lose money any better way to do this thanks,0.0,4.0,None,Neutral,2024-12-08 12:05:45.476859,123
Economics,taxpayers spend 22 more per patient to support medicare advantage  the private alternative to medicare that promised to cost less,2654.0,155.0,None,Neutral,2024-12-08 12:05:58.511779,129
Economics,cloud migration  data management  book a 15 minute call today  see how cloudm can help you,71.0,0.0,None,Neutral,2024-12-08 12:05:58.511875,90
Economics,russia is speeding into a demographic crisis with a 25yearlow birth rate as the ukraine war rages on,2144.0,184.0,None,Neutral,2024-12-08 12:05:58.511967,100
Economics,china announces a ban on rare minerals to the us,1902.0,303.0,None,Neutral,2024-12-08 12:05:58.512053,48
Economics,us commercial real estate is headed toward a crisis harvard business review,1509.0,382.0,None,Neutral,2024-12-08 12:05:58.512138,75
Economics,white collar recession is structural unemployment here to stay,1459.0,439.0,None,Neutral,2024-12-08 12:05:58.512219,62
Economics,how america lost its taste for the middle,1277.0,297.0,None,Neutral,2024-12-08 12:05:58.512297,41
Economics,tariff threats will do harm even if donald trump does not impose them,1148.0,192.0,None,Neutral,2024-12-08 12:05:58.512392,69
Economics,the stock market is doing something observed just 3 times since 1871  and history is crystal clear what happens next,764.0,306.0,None,Neutral,2024-12-08 12:05:58.512479,116
Economics,trump 20 is shaping up to be a roller coaster for the stock market,756.0,169.0,None,Neutral,2024-12-08 12:05:58.512564,66
Economics,china sees sharp drop in billionaires 93 fall off the list as wealth plunges 20 in 2024,693.0,106.0,None,Neutral,2024-12-08 12:05:58.512651,87
Economics,taxpayers spend 22 more per patient to support private alternative to medicare that promised to cost less,689.0,60.0,None,Neutral,2024-12-08 12:05:58.512741,105
